{
  "name": "Amber",
  "version": "1.0.0",
  "author": "silentoplayz (G30)",
  "description": "Warm golden-olive palette reminiscent of polished amber, with a subtle gradient glow.",
  "updateUrl": "https://raw.githubusercontent.com/silentoplayz/theme-designer-pro-presets/main/themes/amber.json",
  "dark": {
    "h": 75,
    "c": 20,
    "l": 20,
    "overrides": {},
    "customCSS": "",
    "customCssEnabled": false,
    "autoScope": true,
    "locks": {},
    "canvasEnabled": false,
    "canvasScript": "",
    "canvasShowAuth": false,
    "themeShowAuth": false,
    "customCssShowAuth": false,
    "gradientEnabled": true,
    "gradientType": "linear",
    "gradientAngle": 135,
    "gradientStops": [
      {
        "color": "#1a1608",
        "position": 0
      },
      {
        "color": "#2e2510",
        "position": 33
      },
      {
        "color": "#1f1a0a",
        "position": 66
      },
      {
        "color": "#1a1608",
        "position": 100
      }
    ],
    "gradientIntensity": 100,
    "gradientAnimation": null,
    "gradientAnimationSpeed": 5,
    "gradientShowAuth": false,
    "gradientRadialPosX": 50,
    "gradientRadialPosY": 50,
    "gradientRadialShape": "ellipse",
    "gradientRadialSize": "farthest-corner",
    "gradientMeshPoints": [],
    "gradientMeshBgColor": "#000000"
  },
  "light": {
    "h": 75,
    "c": 20,
    "l": 20,
    "overrides": {},
    "customCSS": "",
    "customCssEnabled": false,
    "autoScope": true,
    "locks": {},
    "canvasEnabled": false,
    "canvasScript": "",
    "canvasShowAuth": false,
    "themeShowAuth": false,
    "customCssShowAuth": false,
    "gradientEnabled": true,
    "gradientType": "linear",
    "gradientAngle": 135,
    "gradientStops": [
      {
        "color": "#1a1608",
        "position": 0
      },
      {
        "color": "#2e2510",
        "position": 33
      },
      {
        "color": "#1f1a0a",
        "position": 66
      },
      {
        "color": "#1a1608",
        "position": 100
      }
    ],
    "gradientIntensity": 100,
    "gradientAnimation": null,
    "gradientAnimationSpeed": 5,
    "gradientShowAuth": false,
    "gradientRadialPosX": 50,
    "gradientRadialPosY": 50,
    "gradientRadialShape": "ellipse",
    "gradientRadialSize": "farthest-corner",
    "gradientMeshPoints": [],
    "gradientMeshBgColor": "#000000"
  },
  "oled": {
    "h": 75,
    "c": 20,
    "l": 0,
    "overrides": {},
    "customCSS": "",
    "customCssEnabled": false,
    "autoScope": true,
    "locks": {},
    "canvasEnabled": false,
    "canvasScript": "",
    "canvasShowAuth": false,
    "themeShowAuth": false,
    "customCssShowAuth": false,
    "gradientEnabled": true,
    "gradientType": "linear",
    "gradientAngle": 135,
    "gradientStops": [
      {
        "color": "#1a1608",
        "position": 0
      },
      {
        "color": "#2e2510",
        "position": 33
      },
      {
        "color": "#1f1a0a",
        "position": 66
      },
      {
        "color": "#1a1608",
        "position": 100
      }
    ],
    "gradientIntensity": 100,
    "gradientAnimation": null,
    "gradientAnimationSpeed": 5,
    "gradientShowAuth": false,
    "gradientRadialPosX": 50,
    "gradientRadialPosY": 50,
    "gradientRadialShape": "ellipse",
    "gradientRadialSize": "farthest-corner",
    "gradientMeshPoints": [],
    "gradientMeshBgColor": "#000000"
  },
  "her": {
    "h": 75,
    "c": 20,
    "l": 20,
    "overrides": {},
    "customCSS": "",
    "customCssEnabled": false,
    "autoScope": true,
    "locks": {},
    "canvasEnabled": false,
    "canvasScript": "",
    "canvasShowAuth": false,
    "themeShowAuth": false,
    "customCssShowAuth": false,
    "gradientEnabled": true,
    "gradientType": "linear",
    "gradientAngle": 135,
    "gradientStops": [
      {
        "color": "#1a1608",
        "position": 0
      },
      {
        "color": "#2e2510",
        "position": 33
      },
      {
        "color": "#1f1a0a",
        "position": 66
      },
      {
        "color": "#1a1608",
        "position": 100
      }
    ],
    "gradientIntensity": 100,
    "gradientAnimation": null,
    "gradientAnimationSpeed": 5,
    "gradientShowAuth": false,
    "gradientRadialPosX": 50,
    "gradientRadialPosY": 50,
    "gradientRadialShape": "ellipse",
    "gradientRadialSize": "farthest-corner",
    "gradientMeshPoints": [],
    "gradientMeshBgColor": "#000000"
  }
}
