{
  "name": "Midnight",
  "version": "1.0.0",
  "author": "silentoplayz (G30)",
  "description": "Deep indigo tones with a dark linear gradient backdrop. A refined nocturnal palette.",
  "updateUrl": "https://raw.githubusercontent.com/silentoplayz/theme-designer-pro-presets/main/themes/midnight.json",
  "dark": {
    "h": 250,
    "c": 20,
    "l": 15,
    "overrides": {},
    "customCSS": "",
    "customCssEnabled": false,
    "autoScope": true,
    "locks": {},
    "canvasEnabled": false,
    "canvasScript": "",
    "canvasShowAuth": false,
    "themeShowAuth": false,
    "customCssShowAuth": false,
    "gradientEnabled": true,
    "gradientType": "linear",
    "gradientAngle": 135,
    "gradientStops": [
      {
        "color": "#0a0a2e",
        "position": 0
      },
      {
        "color": "#1a1a4e",
        "position": 33
      },
      {
        "color": "#0d1b3e",
        "position": 66
      },
      {
        "color": "#0a0a2e",
        "position": 100
      }
    ],
    "gradientIntensity": 100,
    "gradientAnimation": null,
    "gradientAnimationSpeed": 5,
    "gradientShowAuth": true,
    "gradientRadialPosX": 50,
    "gradientRadialPosY": 50,
    "gradientRadialShape": "ellipse",
    "gradientRadialSize": "farthest-corner",
    "gradientMeshPoints": [],
    "gradientMeshBgColor": "#000000"
  },
  "light": {
    "h": 250,
    "c": 20,
    "l": 15,
    "overrides": {},
    "customCSS": "",
    "customCssEnabled": false,
    "autoScope": true,
    "locks": {},
    "canvasEnabled": false,
    "canvasScript": "",
    "canvasShowAuth": false,
    "themeShowAuth": false,
    "customCssShowAuth": false,
    "gradientEnabled": true,
    "gradientType": "linear",
    "gradientAngle": 135,
    "gradientStops": [
      {
        "color": "#0a0a2e",
        "position": 0
      },
      {
        "color": "#1a1a4e",
        "position": 33
      },
      {
        "color": "#0d1b3e",
        "position": 66
      },
      {
        "color": "#0a0a2e",
        "position": 100
      }
    ],
    "gradientIntensity": 100,
    "gradientAnimation": null,
    "gradientAnimationSpeed": 5,
    "gradientShowAuth": true,
    "gradientRadialPosX": 50,
    "gradientRadialPosY": 50,
    "gradientRadialShape": "ellipse",
    "gradientRadialSize": "farthest-corner",
    "gradientMeshPoints": [],
    "gradientMeshBgColor": "#000000"
  },
  "oled": {
    "h": 250,
    "c": 20,
    "l": 0,
    "overrides": {},
    "customCSS": "",
    "customCssEnabled": false,
    "autoScope": true,
    "locks": {},
    "canvasEnabled": false,
    "canvasScript": "",
    "canvasShowAuth": false,
    "themeShowAuth": false,
    "customCssShowAuth": false,
    "gradientEnabled": true,
    "gradientType": "linear",
    "gradientAngle": 135,
    "gradientStops": [
      {
        "color": "#0a0a2e",
        "position": 0
      },
      {
        "color": "#1a1a4e",
        "position": 33
      },
      {
        "color": "#0d1b3e",
        "position": 66
      },
      {
        "color": "#0a0a2e",
        "position": 100
      }
    ],
    "gradientIntensity": 100,
    "gradientAnimation": null,
    "gradientAnimationSpeed": 5,
    "gradientShowAuth": true,
    "gradientRadialPosX": 50,
    "gradientRadialPosY": 50,
    "gradientRadialShape": "ellipse",
    "gradientRadialSize": "farthest-corner",
    "gradientMeshPoints": [],
    "gradientMeshBgColor": "#000000"
  },
  "her": {
    "h": 250,
    "c": 20,
    "l": 15,
    "overrides": {},
    "customCSS": "",
    "customCssEnabled": false,
    "autoScope": true,
    "locks": {},
    "canvasEnabled": false,
    "canvasScript": "",
    "canvasShowAuth": false,
    "themeShowAuth": false,
    "customCssShowAuth": false,
    "gradientEnabled": true,
    "gradientType": "linear",
    "gradientAngle": 135,
    "gradientStops": [
      {
        "color": "#0a0a2e",
        "position": 0
      },
      {
        "color": "#1a1a4e",
        "position": 33
      },
      {
        "color": "#0d1b3e",
        "position": 66
      },
      {
        "color": "#0a0a2e",
        "position": 100
      }
    ],
    "gradientIntensity": 100,
    "gradientAnimation": null,
    "gradientAnimationSpeed": 5,
    "gradientShowAuth": true,
    "gradientRadialPosX": 50,
    "gradientRadialPosY": 50,
    "gradientRadialShape": "ellipse",
    "gradientRadialSize": "farthest-corner",
    "gradientMeshPoints": [],
    "gradientMeshBgColor": "#000000"
  }
}
