{
  "name": "Topaz",
  "version": "1.0.0",
  "targetVersion": "0.10.0",
  "author": "silentoplayz (G30)",
  "description": "Warm bronze and sienna tones with an earthy gradient backdrop.",
  "updateUrl": "https://raw.githubusercontent.com/silentoplayz/theme-designer-pro-presets/main/themes/topaz.json",
  "repositoryUrl": "https://github.com/silentoplayz/theme-designer-pro-presets",
  "dark": {
    "h": 40,
    "c": 20,
    "l": 18,
    "overrides": {},
    "customCSS": "",
    "customCssEnabled": false,
    "autoScope": true,
    "locks": {},
    "canvasEnabled": false,
    "canvasScript": "",
    "canvasShowAuth": false,
    "themeShowAuth": false,
    "customCssShowAuth": false,
    "gradientEnabled": true,
    "gradientType": "linear",
    "gradientAngle": 135,
    "gradientStops": [
      {
        "color": "#1a140a",
        "position": 0
      },
      {
        "color": "#2e2010",
        "position": 33
      },
      {
        "color": "#241a0c",
        "position": 66
      },
      {
        "color": "#1a140a",
        "position": 100
      }
    ],
    "gradientIntensity": 100,
    "gradientAnimation": null,
    "gradientAnimationSpeed": 5,
    "gradientShowAuth": true,
    "gradientRadialPosX": 50,
    "gradientRadialPosY": 50,
    "gradientRadialShape": "ellipse",
    "gradientRadialSize": "farthest-corner",
    "gradientMeshPoints": [],
    "gradientMeshBgColor": "#000000"
  },
  "light": {
    "h": 40,
    "c": 20,
    "l": 18,
    "overrides": {},
    "customCSS": "",
    "customCssEnabled": false,
    "autoScope": true,
    "locks": {},
    "canvasEnabled": false,
    "canvasScript": "",
    "canvasShowAuth": false,
    "themeShowAuth": false,
    "customCssShowAuth": false,
    "gradientEnabled": true,
    "gradientType": "linear",
    "gradientAngle": 135,
    "gradientStops": [
      {
        "color": "#1a140a",
        "position": 0
      },
      {
        "color": "#2e2010",
        "position": 33
      },
      {
        "color": "#241a0c",
        "position": 66
      },
      {
        "color": "#1a140a",
        "position": 100
      }
    ],
    "gradientIntensity": 100,
    "gradientAnimation": null,
    "gradientAnimationSpeed": 5,
    "gradientShowAuth": true,
    "gradientRadialPosX": 50,
    "gradientRadialPosY": 50,
    "gradientRadialShape": "ellipse",
    "gradientRadialSize": "farthest-corner",
    "gradientMeshPoints": [],
    "gradientMeshBgColor": "#000000"
  },
  "oled": {
    "h": 40,
    "c": 20,
    "l": 0,
    "overrides": {},
    "customCSS": "",
    "customCssEnabled": false,
    "autoScope": true,
    "locks": {},
    "canvasEnabled": false,
    "canvasScript": "",
    "canvasShowAuth": false,
    "themeShowAuth": false,
    "customCssShowAuth": false,
    "gradientEnabled": true,
    "gradientType": "linear",
    "gradientAngle": 135,
    "gradientStops": [
      {
        "color": "#1a140a",
        "position": 0
      },
      {
        "color": "#2e2010",
        "position": 33
      },
      {
        "color": "#241a0c",
        "position": 66
      },
      {
        "color": "#1a140a",
        "position": 100
      }
    ],
    "gradientIntensity": 100,
    "gradientAnimation": null,
    "gradientAnimationSpeed": 5,
    "gradientShowAuth": true,
    "gradientRadialPosX": 50,
    "gradientRadialPosY": 50,
    "gradientRadialShape": "ellipse",
    "gradientRadialSize": "farthest-corner",
    "gradientMeshPoints": [],
    "gradientMeshBgColor": "#000000"
  },
  "her": {
    "h": 40,
    "c": 20,
    "l": 18,
    "overrides": {},
    "customCSS": "",
    "customCssEnabled": false,
    "autoScope": true,
    "locks": {},
    "canvasEnabled": false,
    "canvasScript": "",
    "canvasShowAuth": false,
    "themeShowAuth": false,
    "customCssShowAuth": false,
    "gradientEnabled": true,
    "gradientType": "linear",
    "gradientAngle": 135,
    "gradientStops": [
      {
        "color": "#1a140a",
        "position": 0
      },
      {
        "color": "#2e2010",
        "position": 33
      },
      {
        "color": "#241a0c",
        "position": 66
      },
      {
        "color": "#1a140a",
        "position": 100
      }
    ],
    "gradientIntensity": 100,
    "gradientAnimation": null,
    "gradientAnimationSpeed": 5,
    "gradientShowAuth": true,
    "gradientRadialPosX": 50,
    "gradientRadialPosY": 50,
    "gradientRadialShape": "ellipse",
    "gradientRadialSize": "farthest-corner",
    "gradientMeshPoints": [],
    "gradientMeshBgColor": "#000000"
  }
}
